{
  "network_id": "sonantia-network",
  "protocol_version": "1.0",
  "network_epoch": "SN1-2026-08-02",
  "document_type": "interactions",
  "node_id": "N02",
  "generated_at": "2026-10-12T00:37:13Z",
  "limit": 200,
  "event_count": 200,
  "events": [
    {
      "event_id": "SN1-N02-EVT-2026-10-12T00-37-13Z-006056",
      "event_type": "cycle_completed",
      "occurred_at": "2026-10-12T00:37:13Z",
      "result": "success",
      "details": {
        "cycle_result": "success"
      }
    },
    {
      "event_id": "SN1-N02-EVT-2026-10-12T00-37-13Z-006055",
      "event_type": "site_generated",
      "occurred_at": "2026-10-12T00:37:13Z",
      "result": "success",
      "details": {
        "pages": [
          "index.html",
          "sonantia.html"
        ]
      }
    },
    {
      "event_id": "SN1-N02-EVT-2026-10-12T00-37-13Z-006054",
      "event_type": "message_generated",
      "occurred_at": "2026-10-12T00:37:13Z",
      "result": "success",
      "message_id": "SN1-N02-2026-10-12T00-37-13Z-000670",
      "details": {
        "generator_id": "sonantia-context-composer-06",
        "fallback": false
      }
    },
    {
      "event_id": "SN1-N02-EVT-2026-10-12T00-37-13Z-006053",
      "event_type": "context_collected",
      "occurred_at": "2026-10-12T00:37:13Z",
      "result": "success",
      "details": {
        "weather_provider": "open-meteo-current",
        "weather_source_count": 1
      }
    },
    {
      "event_id": "SN1-N02-EVT-2026-10-12T00-37-13Z-006052",
      "event_type": "context_requested",
      "occurred_at": "2026-10-12T00:37:13Z",
      "result": "success"
    },
    {
      "event_id": "SN1-N02-EVT-2026-10-12T00-37-13Z-006051",
      "event_type": "peer_checked",
      "occurred_at": "2026-10-12T00:37:13Z",
      "result": "success",
      "peer_node_id": "N04",
      "details": {
        "message_count": 48,
        "imported": 4,
        "duplicates": 44,
        "rejected": 0
      }
    },
    {
      "event_id": "SN1-N02-EVT-2026-10-12T00-37-13Z-006050",
      "event_type": "peer_checked",
      "occurred_at": "2026-10-12T00:37:13Z",
      "result": "success",
      "peer_node_id": "N03",
      "details": {
        "message_count": 48,
        "imported": 0,
        "duplicates": 48,
        "rejected": 0
      }
    },
    {
      "event_id": "SN1-N02-EVT-2026-10-12T00-37-13Z-006049",
      "event_type": "peer_checked",
      "occurred_at": "2026-10-12T00:37:13Z",
      "result": "success",
      "peer_node_id": "N01",
      "details": {
        "message_count": 48,
        "imported": 21,
        "duplicates": 27,
        "rejected": 0
      }
    },
    {
      "event_id": "SN1-N02-EVT-2026-10-12T00-37-13Z-006048",
      "event_type": "cycle_started",
      "occurred_at": "2026-10-12T00:37:13Z",
      "result": "success",
      "details": {
        "node_id": "N02"
      }
    },
    {
      "event_id": "SN1-N02-EVT-2026-10-11T20-21-48Z-006047",
      "event_type": "cycle_completed",
      "occurred_at": "2026-10-11T20:21:48Z",
      "result": "success",
      "details": {
        "cycle_result": "success"
      }
    },
    {
      "event_id": "SN1-N02-EVT-2026-10-11T20-21-48Z-006046",
      "event_type": "site_generated",
      "occurred_at": "2026-10-11T20:21:48Z",
      "result": "success",
      "details": {
        "pages": [
          "index.html",
          "sonantia.html"
        ]
      }
    },
    {
      "event_id": "SN1-N02-EVT-2026-10-11T20-21-48Z-006045",
      "event_type": "message_generated",
      "occurred_at": "2026-10-11T20:21:48Z",
      "result": "success",
      "message_id": "SN1-N02-2026-10-11T20-21-48Z-000669",
      "details": {
        "generator_id": "sonantia-context-composer-06",
        "fallback": false
      }
    },
    {
      "event_id": "SN1-N02-EVT-2026-10-11T20-21-48Z-006044",
      "event_type": "context_collected",
      "occurred_at": "2026-10-11T20:21:48Z",
      "result": "success",
      "details": {
        "weather_provider": "open-meteo-current",
        "weather_source_count": 1
      }
    },
    {
      "event_id": "SN1-N02-EVT-2026-10-11T20-21-48Z-006043",
      "event_type": "context_requested",
      "occurred_at": "2026-10-11T20:21:48Z",
      "result": "success"
    },
    {
      "event_id": "SN1-N02-EVT-2026-10-11T20-21-48Z-006042",
      "event_type": "peer_checked",
      "occurred_at": "2026-10-11T20:21:48Z",
      "result": "success",
      "peer_node_id": "N04",
      "details": {
        "message_count": 48,
        "imported": 4,
        "duplicates": 44,
        "rejected": 0
      }
    },
    {
      "event_id": "SN1-N02-EVT-2026-10-11T20-21-48Z-006041",
      "event_type": "peer_checked",
      "occurred_at": "2026-10-11T20:21:48Z",
      "result": "success",
      "peer_node_id": "N03",
      "details": {
        "message_count": 48,
        "imported": 0,
        "duplicates": 48,
        "rejected": 0
      }
    },
    {
      "event_id": "SN1-N02-EVT-2026-10-11T20-21-48Z-006040",
      "event_type": "peer_checked",
      "occurred_at": "2026-10-11T20:21:48Z",
      "result": "success",
      "peer_node_id": "N01",
      "details": {
        "message_count": 48,
        "imported": 21,
        "duplicates": 27,
        "rejected": 0
      }
    },
    {
      "event_id": "SN1-N02-EVT-2026-10-11T20-21-48Z-006039",
      "event_type": "cycle_started",
      "occurred_at": "2026-10-11T20:21:48Z",
      "result": "success",
      "details": {
        "node_id": "N02"
      }
    },
    {
      "event_id": "SN1-N02-EVT-2026-10-11T15-47-21Z-006038",
      "event_type": "cycle_completed",
      "occurred_at": "2026-10-11T15:47:21Z",
      "result": "success",
      "details": {
        "cycle_result": "success"
      }
    },
    {
      "event_id": "SN1-N02-EVT-2026-10-11T15-47-21Z-006037",
      "event_type": "site_generated",
      "occurred_at": "2026-10-11T15:47:21Z",
      "result": "success",
      "details": {
        "pages": [
          "index.html",
          "sonantia.html"
        ]
      }
    },
    {
      "event_id": "SN1-N02-EVT-2026-10-11T15-47-21Z-006036",
      "event_type": "message_generated",
      "occurred_at": "2026-10-11T15:47:21Z",
      "result": "success",
      "message_id": "SN1-N02-2026-10-11T15-47-21Z-000668",
      "details": {
        "generator_id": "sonantia-context-composer-06",
        "fallback": false
      }
    },
    {
      "event_id": "SN1-N02-EVT-2026-10-11T15-47-21Z-006035",
      "event_type": "context_collected",
      "occurred_at": "2026-10-11T15:47:21Z",
      "result": "success",
      "details": {
        "weather_provider": "open-meteo-current",
        "weather_source_count": 1
      }
    },
    {
      "event_id": "SN1-N02-EVT-2026-10-11T15-47-21Z-006034",
      "event_type": "context_requested",
      "occurred_at": "2026-10-11T15:47:21Z",
      "result": "success"
    },
    {
      "event_id": "SN1-N02-EVT-2026-10-11T15-47-21Z-006033",
      "event_type": "peer_checked",
      "occurred_at": "2026-10-11T15:47:21Z",
      "result": "success",
      "peer_node_id": "N04",
      "details": {
        "message_count": 48,
        "imported": 7,
        "duplicates": 41,
        "rejected": 0
      }
    },
    {
      "event_id": "SN1-N02-EVT-2026-10-11T15-47-21Z-006032",
      "event_type": "peer_checked",
      "occurred_at": "2026-10-11T15:47:21Z",
      "result": "success",
      "peer_node_id": "N03",
      "details": {
        "message_count": 48,
        "imported": 0,
        "duplicates": 48,
        "rejected": 0
      }
    },
    {
      "event_id": "SN1-N02-EVT-2026-10-11T15-47-21Z-006031",
      "event_type": "peer_checked",
      "occurred_at": "2026-10-11T15:47:21Z",
      "result": "success",
      "peer_node_id": "N01",
      "details": {
        "message_count": 48,
        "imported": 21,
        "duplicates": 27,
        "rejected": 0
      }
    },
    {
      "event_id": "SN1-N02-EVT-2026-10-11T15-47-21Z-006030",
      "event_type": "cycle_started",
      "occurred_at": "2026-10-11T15:47:21Z",
      "result": "success",
      "details": {
        "node_id": "N02"
      }
    },
    {
      "event_id": "SN1-N02-EVT-2026-10-11T09-01-10Z-006029",
      "event_type": "cycle_completed",
      "occurred_at": "2026-10-11T09:01:10Z",
      "result": "success",
      "details": {
        "cycle_result": "success"
      }
    },
    {
      "event_id": "SN1-N02-EVT-2026-10-11T09-01-10Z-006028",
      "event_type": "site_generated",
      "occurred_at": "2026-10-11T09:01:10Z",
      "result": "success",
      "details": {
        "pages": [
          "index.html",
          "sonantia.html"
        ]
      }
    },
    {
      "event_id": "SN1-N02-EVT-2026-10-11T09-01-10Z-006027",
      "event_type": "message_generated",
      "occurred_at": "2026-10-11T09:01:10Z",
      "result": "success",
      "message_id": "SN1-N02-2026-10-11T09-01-10Z-000667",
      "details": {
        "generator_id": "sonantia-context-composer-06",
        "fallback": false
      }
    },
    {
      "event_id": "SN1-N02-EVT-2026-10-11T09-01-10Z-006026",
      "event_type": "context_collected",
      "occurred_at": "2026-10-11T09:01:10Z",
      "result": "success",
      "details": {
        "weather_provider": "open-meteo-current",
        "weather_source_count": 1
      }
    },
    {
      "event_id": "SN1-N02-EVT-2026-10-11T09-01-10Z-006025",
      "event_type": "context_requested",
      "occurred_at": "2026-10-11T09:01:10Z",
      "result": "success"
    },
    {
      "event_id": "SN1-N02-EVT-2026-10-11T09-01-10Z-006024",
      "event_type": "peer_checked",
      "occurred_at": "2026-10-11T09:01:10Z",
      "result": "success",
      "peer_node_id": "N04",
      "details": {
        "message_count": 48,
        "imported": 7,
        "duplicates": 41,
        "rejected": 0
      }
    },
    {
      "event_id": "SN1-N02-EVT-2026-10-11T09-01-10Z-006023",
      "event_type": "peer_checked",
      "occurred_at": "2026-10-11T09:01:10Z",